{
  "$schema": "https://json-schema.org/draft/2020-12/schema",
  "$id": "https://hypertrophy-bible.dev/schemas/exercise.json",
  "title": "Exercise",
  "type": "object",
  "additionalProperties": false,
  "required": ["id", "name", "primary_muscles", "mechanic", "equipment", "movement_pattern"],
  "properties": {
    "id": { "type": "string", "pattern": "^[a-z0-9-]+$" },
    "name": { "type": "string" },
    "aliases": { "type": "array", "items": { "type": "string" } },
    "primary_muscles": {
      "type": "array",
      "items": { "type": "string" },
      "minItems": 1,
      "description": "Muscle ids this exercise trains as a primary target"
    },
    "secondary_muscles": { "type": "array", "items": { "type": "string" } },
    "movement_pattern": {
      "enum": [
        "horizontal-push", "vertical-push", "horizontal-pull", "vertical-pull",
        "squat", "hinge", "lunge", "carry",
        "isolation-elbow-flexion", "isolation-elbow-extension",
        "isolation-knee-extension", "isolation-knee-flexion",
        "isolation-hip-extension", "isolation-hip-abduction",
        "isolation-shoulder-abduction", "isolation-shoulder-flexion", "isolation-shoulder-extension",
        "isolation-plantarflexion", "isolation-wrist", "isolation-spinal-flexion",
        "isolation-neck", "isolation-other",
        "other"
      ]
    },
    "equipment": {
      "enum": ["barbell", "dumbbell", "machine", "cable", "smith-machine", "bodyweight", "band", "kettlebell", "other"]
    },
    "mechanic": { "enum": ["compound", "isolation"] },
    "force": {
      "enum": ["push", "pull", "static"],
      "description": "Descriptive metadata only — nothing in the engine consumes it. The plan critique balances push/pull by MUSCLE GROUP (chest/front-delts/triceps vs upper-back/lats/rear-delts/biceps), which is the right model for hypertrophy volume; do not wire this field into that check without revisiting the ambiguous cases (lateral raises, abs, hip abduction)."
    },
    "plane": {
      "type": "array",
      "items": { "enum": ["sagittal", "frontal", "transverse"] }
    },
    "resistance_profile": {
      "type": "string",
      "description": "Where in the ROM the exercise is hardest, e.g. 'hardest in the lengthened position'"
    },
    "lengthened_bias": {
      "type": "boolean",
      "description": "Loads the stretched/lengthened position heavily. Kept for the plan engine (which reads this boolean); MUST equal (loading_bias === 'lengthened') when loading_bias is present."
    },
    "loading_bias": {
      "enum": ["lengthened", "shortened", "mid-range", "uniform"],
      "description": "Where in the range the exercise challenges the muscle most: 'lengthened' (hardest at the stretch — e.g. incline curl, RDL), 'shortened' (hardest at peak contraction — e.g. leg extension, cable crossover), 'mid-range' (hardest mid-way — most free-weight compounds), or 'uniform' (cables/machines with an even profile). The reader-facing, richer version of lengthened_bias."
    },
    "stability": { "enum": ["high", "moderate", "low"] },
    "unilateral": { "type": "boolean" },
    "alternating": {
      "type": "boolean",
      "description": "A unilateral lift whose sides alternate every rep by design (walking lunge) rather than finishing one side first. The session player's side cue reads it; check-data-refs requires unilateral:true alongside it."
    },
    "cns_cost": {
      "enum": ["low", "moderate", "high"],
      "description": "Systemic / central-nervous-system fatigue cost per hard set. Heavy multi-joint barbell lifts (squat, deadlift) are 'high'; most machine/cable isolations are 'low'. Informs how many can be programmed together and recovery between sessions."
    },
    "rom_notes": { "type": "string" },
    "difficulty": { "enum": ["beginner", "intermediate", "advanced"] },
    "cues": { "type": "array", "items": { "type": "string" } },
    "execution_steps": {
      "type": "array",
      "items": { "type": "string" },
      "description": "Ordered step-by-step guide to performing the exercise from setup to finish — the 'how do I do this?' walkthrough a novice can follow."
    },
    "good_when": {
      "type": "array",
      "items": { "type": "string" },
      "description": "Situations where this is a strong pick (e.g. 'limited equipment', 'want a deep loaded stretch', 'lower-back-friendly quad work')."
    },
    "bad_when": {
      "type": "array",
      "items": { "type": "string" },
      "description": "Situations where a different exercise is better (e.g. 'cranky lower back', 'no way to progress load', 'shoulder impingement')."
    },
    "common_errors": { "type": "array", "items": { "type": "string" } },
    "progressions": { "type": "array", "items": { "type": "string" }, "description": "How to make it harder (add load, reps, ROM, tempo, or a harder variation)." },
    "regressions": { "type": "array", "items": { "type": "string" }, "description": "How to make it easier (less load/ROM, a supported or assisted variation)." },
    "citations": { "type": "array", "items": { "type": "string" } }
  }
}
